{"schema":"chronon.render-plan","version":1,"job_id":"modern-overlay-07-bottom-card-rise","canvas":{"width":1920,"height":1080,"fps_num":30,"fps_den":1,"duration_frames":150},"layers":[{"id":"background","type":"color","color":[0,0,0,1]},{"id":"image","type":"image","asset":"assets/test_image.png","box_width":520,"box_height":320,"fit":"contain","position":[0,0],"animation":{"preset":"reveal_from_bottom"},"start_frame":10,"duration_frames":120}],"output":{"path":"modern_overlay_07_bottom_card_rise.mp4","format":"mp4","codec":"h264"}}
