{
  "schema": "chronon.render-plan",
  "version": 1,
  "job_id": "phrase-animation-01-fade",
  "canvas": { "width": 1280, "height": 720, "fps_num": 30, "fps_den": 1, "duration_frames": 150 },
  "layers": [
    { "id": "background", "type": "color", "color": [0.0, 0.0, 0.0, 1.0] },
    { "id": "phrase", "type": "text", "text": "INIZIA DA QUI", "font": "assets/fonts/Poppins-Bold.ttf", "font_size": 86, "color": [1.0, 1.0, 1.0, 1.0], "position": [640, 360], "animation": { "preset": "fade_in" }, "start_frame": 10, "duration_frames": 120 }
  ],
  "output": { "path": "phrase_animation_01_fade.mp4", "format": "mp4", "codec": "h264" }
}
