{"schema":"chronon.render-plan","version":1,"job_id":"modern-overlay-01-fast-fade","canvas":{"width":1920,"height":1080,"fps_num":30,"fps_den":1,"duration_frames":150},"layers":[{"id":"background","type":"color","color":[0,0,0,1]},{"id":"phrase","type":"text","text":"FAST FADE-THROUGH","font":"assets/fonts/Poppins-Bold.ttf","font_size":100,"color":[1,1,1,1],"position":[960,540],"animation":{"preset":"fade_in"},"start_frame":10,"duration_frames":120}],"output":{"path":"modern_overlay_01_fast_fade.mp4","format":"mp4","codec":"h264"}}
