{"schema":"chronon.render-plan","version":1,"job_id":"special-name-presets-smoke","canvas":{"width":1920,"height":1080,"fps_num":30,"fps_den":1,"duration_frames":150},"layers":[{"id":"background","type":"color","color":[0,0,0,1]},{"id":"person","type":"text","text":"ADA LOVELACE","preset":"name_glow_typewriter","start_frame":10,"duration_frames":120},{"id":"organization","type":"text","text":"ANALYTICAL ENGINE","preset":"name_glow_slide","start_frame":10,"duration_frames":120},{"id":"location","type":"text","text":"LONDON","preset":"name_glow_pop","start_frame":10,"duration_frames":120}],"output":{"path":"special_name_presets_smoke.mp4","format":"mp4","codec":"h264"}}
