{
  "schema": "chronon.render-plan",
  "version": 1,
  "job_id": "preset-caption-card-gpu-v1",
  "canvas": { "width": 1280, "height": 720, "fps_num": 30, "fps_den": 1, "duration_frames": 90 },
  "layers": [
    {
      "id": "background",
      "type": "image",
      "asset": "assets/test_image.png",
      "box_width": 1280,
      "box_height": 720,
      "fit": "cover",
      "start_frame": 0,
      "duration_frames": 90
    },
    {
      "id": "caption_card",
      "type": "text",
      "text": "QUESTO CAMBIA TUTTO",
      "preset": "caption_card",
      "font": "assets/fonts/Poppins-Bold.ttf",
      "position": [0, 0],
      "start_frame": 15,
      "duration_frames": 60
    }
  ],
  "output": { "path": "result.mp4", "format": "mp4", "codec": "h264" }
}
